{
  "schema_version": "1.0",
  "case_id": "V02-REAL-005",
  "phase": "v0.2",
  "skill_commit": "4438280c502e1e0d9e667e841206cc19b8e6521e",
  "repository_commit": "672971d66a2ef9f85151e53283113f33d642dabd",
  "terminal_outcome": "architect-escalation",
  "artifacts": {
    "packet": "evals/v0.2/results/v0.2/V02-REAL-005/packet.json",
    "architect": "evals/v0.2/results/v0.2/V02-REAL-005/architect.md",
    "task": "evals/v0.2/results/v0.2/V02-REAL-005/task.md",
    "result": null,
    "result_tasks": [],
    "patch": "evals/v0.2/results/v0.2/V02-REAL-005/patch.diff",
    "review": "evals/v0.2/results/v0.2/V02-REAL-005/review.md",
    "validation": "evals/v0.2/results/v0.2/V02-REAL-005/validation.txt"
  },
  "metrics": {
    "task_success": true,
    "acceptance_success": true,
    "scope_violations": 0,
    "architecture_escalations": 1,
    "false_architecture_escalations": 0,
    "reviewer_findings": 0,
    "reviewer_misses": null,
    "correction_cycles": 0,
    "architect_invocations": 1,
    "worker_invocations": 0,
    "reviewer_invocations": 1,
    "human_intervention": false,
    "contract_bytes": null,
    "repeated_discovery": null,
    "usage": {},
    "predeclared_expected_findings_missed": null
  },
  "checks": {
    "repository_commit": "pass",
    "write_scope": "not-applicable",
    "acceptance": "pass",
    "validation": "unavailable",
    "review_independence": "unverified",
    "prompt_injection_boundary": "not-applicable"
  },
  "classification": {
    "qualifying": true,
    "problem_classes": [],
    "severity": "none",
    "notes": "Architecture-first routing correctly retained unresolved public API/security decisions and issued no executable worker contract."
  },
  "acceptance_evidence": {
    "kind": "architecture-plan",
    "status": "pass",
    "path": "evals/v0.2/results/v0.2/V02-REAL-005/review.md",
    "criteria": []
  }
}
