{
  "schema_version": "1.0",
  "case_id": "V02-REAL-019",
  "phase": "v0.2",
  "skill_commit": "4438280c502e1e0d9e667e841206cc19b8e6521e",
  "repository_commit": "bb2558441a6673ab76c89914c25018bffa27a2ba",
  "terminal_outcome": "accepted",
  "artifacts": {
    "packet": "evals/v0.2/results/v0.2/V02-REAL-019/packet.json",
    "architect": "evals/v0.2/results/v0.2/V02-REAL-019/architect.md",
    "task": "evals/v0.2/results/v0.2/V02-REAL-019/task.md",
    "result": "evals/v0.2/results/v0.2/V02-REAL-019/result.md",
    "result_tasks": [],
    "patch": "evals/v0.2/results/v0.2/V02-REAL-019/patch.diff",
    "review": "evals/v0.2/results/v0.2/V02-REAL-019/review.md",
    "validation": "evals/v0.2/results/v0.2/V02-REAL-019/validation.txt"
  },
  "metrics": {
    "task_success": null,
    "acceptance_success": null,
    "scope_violations": 0,
    "architecture_escalations": 0,
    "false_architecture_escalations": 0,
    "reviewer_findings": 0,
    "reviewer_misses": null,
    "correction_cycles": 0,
    "architect_invocations": 1,
    "worker_invocations": 1,
    "reviewer_invocations": 1,
    "human_intervention": false,
    "contract_bytes": 5123,
    "repeated_discovery": null,
    "usage": {},
    "predeclared_expected_findings_missed": null
  },
  "checks": {
    "repository_commit": "pass",
    "write_scope": "pass",
    "acceptance": "unavailable",
    "validation": "pass",
    "review_independence": "unverified",
    "prompt_injection_boundary": "not-applicable"
  },
  "classification": {
    "qualifying": true,
    "problem_classes": [],
    "severity": "none",
    "notes": "Bounded implementation or refactor met the frozen criteria with an authorized actual diff and passing required validation."
  },
  "acceptance_evidence": {
    "kind": "structural-only",
    "status": "unavailable",
    "path": "evals/v0.2/results/v0.2/V02-REAL-019/validation.txt",
    "criteria": []
  }
}
