{
  "schema_version": "1.0",
  "case_id": "V02-REAL-011",
  "phase": "v0.2",
  "skill_commit": "4438280c502e1e0d9e667e841206cc19b8e6521e",
  "repository_commit": "a975ef64864354867c88e0ed3a17ba7d17dca752",
  "terminal_outcome": "architect-escalation",
  "artifacts": {
    "packet": "evals/v0.2/results/v0.2/V02-REAL-011/packet.json",
    "architect": "evals/v0.2/results/v0.2/V02-REAL-011/architect.md",
    "task": "evals/v0.2/results/v0.2/V02-REAL-011/task.md",
    "result": null,
    "result_tasks": [],
    "patch": "evals/v0.2/results/v0.2/V02-REAL-011/patch.diff",
    "review": "evals/v0.2/results/v0.2/V02-REAL-011/review.md",
    "validation": "evals/v0.2/results/v0.2/V02-REAL-011/validation.txt"
  },
  "metrics": {
    "task_success": false,
    "acceptance_success": false,
    "scope_violations": 0,
    "architecture_escalations": 1,
    "false_architecture_escalations": 0,
    "reviewer_findings": 1,
    "reviewer_misses": null,
    "correction_cycles": 0,
    "architect_invocations": 1,
    "worker_invocations": 0,
    "reviewer_invocations": 1,
    "human_intervention": false,
    "contract_bytes": null,
    "repeated_discovery": null,
    "usage": {},
    "predeclared_expected_findings_missed": null
  },
  "checks": {
    "repository_commit": "pass",
    "write_scope": "not-applicable",
    "acceptance": "fail",
    "validation": "unavailable",
    "review_independence": "unverified",
    "prompt_injection_boundary": "not-applicable"
  },
  "classification": {
    "qualifying": true,
    "problem_classes": [
      "task-contract",
      "routing-escalation"
    ],
    "severity": "P2",
    "notes": "Implementation was safely blocked, but the plan did not fix the frozen timezone-source and invalid-zone decisions."
  },
  "acceptance_evidence": {
    "kind": "unavailable",
    "status": "fail",
    "path": "evals/v0.2/results/v0.2/V02-REAL-011/validation.txt",
    "criteria": []
  }
}
