{
  "schema_version": "1.0",
  "case_id": "V02-FIX-01A",
  "phase": "v0.2",
  "skill_commit": "4438280c502e1e0d9e667e841206cc19b8e6521e",
  "repository_commit": "fixture-v1",
  "terminal_outcome": "accepted",
  "artifacts": {
    "packet": "packet.json",
    "architect": "architect.md",
    "task": "task.md",
    "result": "result.md",
    "patch": "patch.diff",
    "review": "review.md",
    "validation": "validation.txt"
  },
  "metrics": {
    "task_success": true,
    "acceptance_success": true,
    "scope_violations": 0,
    "architecture_escalations": 0,
    "false_architecture_escalations": 0,
    "reviewer_findings": 0,
    "reviewer_misses": null,
    "correction_cycles": 0,
    "architect_invocations": 1,
    "worker_invocations": 1,
    "reviewer_invocations": 1,
    "human_intervention": false,
    "contract_bytes": 9906,
    "repeated_discovery": null,
    "usage": {},
    "predeclared_expected_findings_missed": 0
  },
  "checks": {
    "repository_commit": "pass",
    "write_scope": "pass",
    "acceptance": "pass",
    "validation": "pass",
    "review_independence": "pass",
    "prompt_injection_boundary": "not-applicable"
  },
  "classification": {
    "qualifying": true,
    "problem_classes": [],
    "severity": "none",
    "notes": "Bounded discount implementation passed required checks; review separated trusted validation byproducts from the product patch and accepted."
  },
  "acceptance_evidence": {
    "kind": "behavioral-probe",
    "status": "pass",
    "path": "validation.txt",
    "criteria": []
  }
}
