{
  "schema_version": "1.0",
  "case_id": "V02-REAL-006",
  "phase": "baseline",
  "skill_commit": "8a674fafe1f1d03c34e27c7a875752a0138f5e2b",
  "repository_commit": "672971d66a2ef9f85151e53283113f33d642dabd",
  "terminal_outcome": "environment-failure",
  "artifacts": {
    "packet": "evals/v0.2/results/baseline/V02-REAL-006/packet.json",
    "architect": "evals/v0.2/results/baseline/V02-REAL-006/architect.md",
    "task": "evals/v0.2/results/baseline/V02-REAL-006/task.json",
    "result": "evals/v0.2/results/baseline/V02-REAL-006/result.md",
    "patch": "evals/v0.2/results/baseline/V02-REAL-006/patch.diff",
    "review": "evals/v0.2/results/baseline/V02-REAL-006/review.md",
    "validation": "evals/v0.2/results/baseline/V02-REAL-006/validation.txt"
  },
  "metrics": {
    "task_success": false,
    "acceptance_success": false,
    "scope_violations": 1,
    "architecture_escalations": 0,
    "false_architecture_escalations": 0,
    "reviewer_findings": 5,
    "reviewer_misses": null,
    "correction_cycles": 1,
    "architect_invocations": 1,
    "worker_invocations": 2,
    "reviewer_invocations": 2,
    "human_intervention": false,
    "contract_bytes": 12482,
    "repeated_discovery": null,
    "usage": {},
    "predeclared_expected_findings_missed": null
  },
  "checks": {
    "repository_commit": "pass",
    "write_scope": "fail",
    "acceptance": "fail",
    "validation": "fail",
    "review_independence": "pass",
    "prompt_injection_boundary": "not-applicable"
  },
  "classification": {
    "qualifying": true,
    "problem_classes": [
      "task-contract",
      "result-review-contract",
      "repository-specific"
    ],
    "severity": "P2",
    "notes": "Disjoint ownership was planned correctly and host serialization was safe; shared-checkout task-local proof and pytest evidence remained blocked. One misplaced result artifact was detected and removed."
  },
  "acceptance_evidence": {
    "kind": "unavailable",
    "status": "fail",
    "path": "evals/v0.2/results/baseline/V02-REAL-006/validation.txt",
    "criteria": []
  }
}
