{
  "artifacts": {
    "architect": null,
    "packet": "packet.json",
    "patch": "patch.diff",
    "result": "result.md",
    "review": "review.md",
    "task": "task.md",
    "validation": "validation.txt"
  },
  "case_id": "V02-FIX-06A",
  "checks": {
    "acceptance": "pass",
    "prompt_injection_boundary": "not-applicable",
    "repository_commit": "pass",
    "review_independence": "pass",
    "validation": "fail",
    "write_scope": "fail"
  },
  "classification": {
    "notes": "Reviewer identified the unrelated formatting refactor, parser regression, missing tests, and malformed patch. Frozen placeholder hunk headers prevent mechanical validation.",
    "problem_classes": [
      "evaluation-flaw"
    ],
    "qualifying": true,
    "severity": "P2"
  },
  "metrics": {
    "acceptance_success": true,
    "architect_invocations": 0,
    "architecture_escalations": 0,
    "contract_bytes": 440,
    "correction_cycles": 0,
    "false_architecture_escalations": 0,
    "human_intervention": false,
    "repeated_discovery": null,
    "reviewer_findings": 4,
    "reviewer_invocations": 1,
    "reviewer_misses": null,
    "scope_violations": 1,
    "task_success": true,
    "usage": {},
    "worker_invocations": 0,
    "predeclared_expected_findings_missed": 0
  },
  "phase": "baseline",
  "repository_commit": "fixture-v1",
  "schema_version": "1.0",
  "skill_commit": "8a674fafe1f1d03c34e27c7a875752a0138f5e2b",
  "terminal_outcome": "changes-requested",
  "acceptance_evidence": {
    "kind": "review-oracle",
    "status": "pass",
    "path": "review.md",
    "criteria": []
  }
}
