{
  "schema_version": "1.0",
  "case_id": "V02-SUP-FIX-02",
  "phase": "supplemental-v0.2",
  "skill_commit": "4438280c502e1e0d9e667e841206cc19b8e6521e",
  "repository_commit": "fixture-v1",
  "terminal_outcome": "architect-escalation",
  "artifacts": {
    "packet": "evals/v0.2/supplemental/cases.json",
    "architect": "evals/v0.2/supplemental/evidence/V02-SUP-FIX-02.md",
    "task": "evals/v0.2/supplemental/cases.json",
    "result": "evals/v0.2/supplemental/evidence/V02-SUP-FIX-02.md",
    "patch": "evals/v0.2/supplemental/candidates/V02-SUP-FIX-02/candidate-round-1.patch",
    "review": "evals/v0.2/supplemental/evidence/V02-SUP-FIX-02.md",
    "validation": "evals/v0.2/supplemental/evidence/V02-SUP-FIX-02.md",
    "candidate_states": [
      "evals/v0.2/supplemental/candidates/V02-SUP-FIX-02/candidate-round-1.patch",
      "evals/v0.2/supplemental/candidates/V02-SUP-FIX-02/candidate-round-2.patch"
    ]
  },
  "metrics": {
    "task_success": true,
    "acceptance_success": true,
    "scope_violations": 0,
    "architecture_escalations": 1,
    "false_architecture_escalations": 0,
    "reviewer_findings": 2,
    "reviewer_misses": null,
    "predeclared_expected_findings_missed": 0,
    "correction_cycles": 2,
    "architect_invocations": 1,
    "worker_invocations": 0,
    "reviewer_invocations": 2,
    "human_intervention": false,
    "contract_bytes": null,
    "repeated_discovery": null,
    "usage": {}
  },
  "checks": {
    "repository_commit": "pass",
    "write_scope": "pass",
    "acceptance": "pass",
    "validation": "pass",
    "review_independence": "unverified",
    "prompt_injection_boundary": "not-applicable"
  },
  "acceptance_evidence": {
    "kind": "review-oracle",
    "status": "pass",
    "path": "evals/v0.2/supplemental/evidence/V02-SUP-FIX-02.md",
    "criteria": [
      "retry_delay returns int values",
      "attempts above 8 raise ValueError",
      "no third correction is requested"
    ]
  },
  "classification": {
    "qualifying": true,
    "problem_classes": [],
    "severity": "none",
    "notes": "Supplemental frozen candidate states were exercised through two review rounds."
  }
}
