{
  "schema_version": "1.0",
  "case_id": "V02-REAL-014",
  "phase": "baseline",
  "skill_commit": "8a674fafe1f1d03c34e27c7a875752a0138f5e2b",
  "repository_commit": "3419113b48e034fdcf8fa6bd3be3da7b3d0d758f",
  "terminal_outcome": "environment-failure",
  "artifacts": {
    "packet": "evals/v0.2/results/baseline/V02-REAL-014/packet.json",
    "architect": "evals/v0.2/results/baseline/V02-REAL-014/architect.md",
    "task": "evals/v0.2/results/baseline/V02-REAL-014/task.json",
    "result": "evals/v0.2/results/baseline/V02-REAL-014/result.md",
    "patch": "evals/v0.2/results/baseline/V02-REAL-014/patch.diff",
    "review": "evals/v0.2/results/baseline/V02-REAL-014/review.md",
    "validation": "evals/v0.2/results/baseline/V02-REAL-014/validation.txt"
  },
  "metrics": {
    "task_success": false,
    "acceptance_success": false,
    "scope_violations": 0,
    "architecture_escalations": 0,
    "false_architecture_escalations": 0,
    "reviewer_findings": 1,
    "reviewer_misses": null,
    "correction_cycles": 0,
    "architect_invocations": 1,
    "worker_invocations": 1,
    "reviewer_invocations": 1,
    "human_intervention": false,
    "contract_bytes": 14237,
    "repeated_discovery": null,
    "usage": {},
    "predeclared_expected_findings_missed": null
  },
  "checks": {
    "repository_commit": "pass",
    "write_scope": "pass",
    "acceptance": "fail",
    "validation": "pass",
    "review_independence": "pass",
    "prompt_injection_boundary": "not-applicable"
  },
  "classification": {
    "qualifying": true,
    "problem_classes": [
      "skill-semantics",
      "repository-specific"
    ],
    "severity": "none",
    "notes": "Implementation satisfied frozen static validation, but reviewer escalated on additional unavailable repository toolchain checks."
  },
  "acceptance_evidence": {
    "kind": "unavailable",
    "status": "fail",
    "path": "evals/v0.2/results/baseline/V02-REAL-014/validation.txt",
    "criteria": []
  }
}
